### ISSUE TITLE
Inbound TCP Port Forwarding broken due to Asymmetric Routing / Missing reply-to on multi-VLAN setups

### ISSUE THREAD

**Issue by Nixxeee** [FingerlessGlov3s/OPNsensePIAWireguard#100]
### Describe the bug
I am using this amazing script to handle PIA Port Forwarding on my OPNsense firewall. While inbound UDP traffic works flawlessly (DHT/uTP connections are established and active), inbound TCP traffic fails. 

The port appears "Closed" on external scanning tools. Thanks to deep `tcpdump` debugging, I have identified a severe asymmetric routing issue: the TCP SYN packets enter perfectly through the WireGuard interface (`wg3`) and reach the local host, but the `SYN-ACK` replies from the local host bypass the WireGuard gateway and egress directly out of my physical WAN interface (`vlan01`).

### My Architecture
* **OPNsense** handling the PIA WireGuard tunnel (`wg3`) via this script.
* **Network isolation:** The target client (qBittorrent) lives inside a dedicated VLAN interface (`vlan0.3.541`).
* **Docker Host:** Inside that VLAN, the container uses a `macvlan` network type (IP `10.60.0.2`).

### Evidence & Packet Captures

**1. Verification on the Local VLAN interface (`vlan0.3.541`)**
The packet successfully reaches the container, and the container instantly replies with a `SYN-ACK` `[S.]`:
```text
21:50:30.440357 IP 45.128.39.115.51222 > 10.60.0.2.30994: Flags [S], seq 4025830492, win 64240, options [mss 1357...]
21:50:30.440417 IP 10.60.0.2.30994 > 45.128.39.115.51222: Flags [S.], seq 2312528461, ack 4025830493, win 43440 [mss 1460...]
```

**2. Verification on OPNsense pflog0 (Firewall Engine)**
The firewall correctly intercepts the incoming packet, applies DNAT to the Macvlan IP, and rewrites the MSS option natively:

```text
23:27:39.967996 IP 130.195.223.8.4162 > 10.72.1.148.30994: Flags [S], mss 1460
23:27:39.968013 IP 130.195.223.8.4162 > 10.60.0.2.30994: Flags [S], mss 1460
23:27:39.968031 IP 130.195.223.8.4162 > 10.60.0.2.30994: Flags [S], mss 1380
```
(Note: No corresponding SYN-ACK ever appears in the pflog0 state table context).

**3. The Smoking Gun: Verification on the physical WAN interface (vlan01)**
Instead of going back into the WireGuard tunnel, the SYN-ACK reply leaks out of the default physical WAN gateway. OPNsense applies the NAT (rewriting the source to the WG local IP 10.72.1.148), but routes it to the wrong interface:

```
21:53:49.978288 IP 10.72.1.148.30994 > 46.232.211.197.50419: Flags [S.], seq 417914279, ack 901039056...
```
Because the remote peer receives a SYN-ACK from my real home public IP instead of the PIA IP it queried, the TCP handshake is dropped.

What I've tried so far
I disabled Shared Forwarding and Sticky Connections in OPNsense settings to avoid standard multi-WAN routing shortcuts, but the issue persists.

This seems highly related to old core issues (like #4389 or #5083) where FreeBSD pf fails to bind the state of a reply-to directive when dealing with nested virtual layers (WireGuard -> VLAN interface -> Docker Macvlan).

### Question / Help requested
What is the correct way to force OPNsense to use the correct WireGuard interface for the return path without breaking the script's automation ?

**Comment by FingerlessGlov3s** [comment]
If pf reply-to isn't working right, that's not something the script controls, it only looks after the interface and gateway setup.

I would make sure you're fully patched give it a reboot, then see if the problem still persists. There have been the odd updates in the last by OPNsense that has broken reply-to working correctly, but I'm not aware of any at the moment.

Ideally long as the IP `10.60.0.2` is configured to get too the internet via the PIA WG interface, then even if the packet became out of state on the connections table, it should then fire it back out the WG interface, so make sure you're correctly setting the gateway on the allow rule for "vlan 541" -> PIA

**Comment by Nixxeee** [comment]
Thanks for the quick feedback! 

I can confirm that the gateway is already explicitly set to `GW_PIAFrance` inside my VLAN 541 firewall rules (it is not set to default). Here are the screenshots of my current configuration to show the exact setup:

VLAN 541 Firewall rules :
<img width="1561" height="1031" alt="Image" src="https://github.com/user-attachments/assets/972b16e3-d5d1-46ec-8aac-f70697bbe5bc" />

NAT Port forward rule:
<img width="900" height="946" alt="Image" src="https://github.com/user-attachments/assets/4b642f62-0018-4954-9452-59f5b45dfc91" />

NAT Outbound rule: 
<img width="867" height="1148" alt="Image" src="https://github.com/user-attachments/assets/9f04db0d-5081-4f69-9c6a-75d9700a39dc" />
SUBNETS_NAT_VPN contain 10.60.0.2/32

Even with this strict gateway rule enforced on the VLAN, the `SYN-ACK` packet still leaks out of the physical WAN. Any extra eyes on these rules would be highly appreciated!
